{
  "schema_version": "1.0",
  "insight_id": "insight-m3-e2e-run",
  "run_id": "m3-e2e-run",
  "generated_at": "2026-10-17T08:49:55.722278Z",
  "headline": "The Sahm recession indicator meets its conventional threshold.",
  "what_changed": "Evaluation month 2024-12-01: three-month average 4.50% versus a prior 12-month low of 4.00% (gap 0.50 percentage points). Published 0.50 threshold met: true. Threshold crossed (prior month below threshold): false.",
  "why_it_matters": "The Sahm rule measures how far the three-month average unemployment rate has risen above its recent low. It is associated with recessions already under way in US history. It is not an NBER recession call, a guaranteed forward forecast, or a market-timing rule.",
  "historical_context": "The Sahm rule was proposed by Claudia Sahm as a real-time recession indicator based on labour-market deterioration. Aqil applies the published arithmetic only; this run does not claim an academic replication certificate or a validated point-in-time historical study.",
  "investor_implications": "For a long-horizon investor, this is one labour-market signal to monitor alongside inflation, policy and portfolio goals. Economic conditions, market pricing, asset allocation and specific trades remain distinct. Investment implication from the engine: no_action. Market pricing assessed here: unknown.",
  "confidence_and_limitations": "Data sufficiency: sufficient. Analysis mode: latest_revised. These rows are labelled latest-revised retrospective data from BLS. They reflect values published today, not what was known at an earlier decision date. They must not be used for genuine point-in-time backtests until independently archived provider vintages exist. Verification: unverified. Publication allowed: False. Evidence: publication gate remains fail-closed, this assessment is not claim or span verification.",
  "what_comes_next": "Monitor the monthly BLS employment situation release for revised unemployment rates. Related measures include payroll growth and participation; they are not substituted here.",
  "method_id": "SAHM_UNEMPLOYMENT_GAP",
  "method_version": "1.0.1",
  "dataset_id": "bls.ln.LNS14000000",
  "analysis_mode": "latest_revised",
  "data_provenance": "latest_revised",
  "publication_status": "internal_preview",
  "verification_status": "unverified",
  "calculation_summary": {
    "evaluation_period": "2024-12-01",
    "three_month_average": "4.50",
    "prior_twelve_month_low_of_average": "4.00",
    "gap_percentage_points": "0.50",
    "threshold_percentage_points": "0.50",
    "triggered": true,
    "threshold_met": true,
    "threshold_crossed": false,
    "months_used_for_average": [
      "2024-10-01",
      "2024-11-01",
      "2024-12-01"
    ],
    "months_used_for_lookback": [
      "2023-12-01",
      "2024-01-01",
      "2024-02-01",
      "2024-03-01",
      "2024-04-01",
      "2024-05-01",
      "2024-06-01",
      "2024-07-01",
      "2024-08-01",
      "2024-09-01",
      "2024-10-01",
      "2024-11-01"
    ],
    "observation_ids": [
      "bls-202310-4051d2873d293be5a5d551b1",
      "bls-202311-993bd6d74ff8edbed313b20c",
      "bls-202312-bd7253f74e820aace7b7c609",
      "bls-202401-4b1632283428fb8491fa4e4c",
      "bls-202402-3367cffdd495715cb27fe0ce",
      "bls-202403-7a21e6ad826eb1ca2f9f465b",
      "bls-202404-20a4f0f983b62623b9b8ef29",
      "bls-202405-11e4175735ded8d14cd78a8f",
      "bls-202406-e25960a671e167fd5eb56f42",
      "bls-202407-f86fa133dc1713142e16436b",
      "bls-202408-432dfb230e2925cf2d0fb0e1",
      "bls-202409-5cf7d420412d1cce3ff8d00d",
      "bls-202410-c6d331bdade079d442c525a1",
      "bls-202411-910ac0fb77d0243604bca02c",
      "bls-202412-0c64fccc9a411d3022d37b10"
    ],
    "assumptions": [
      "US seasonally adjusted U-3 unemployment rate in percent.",
      "Three-month average uses the evaluation month and the two prior months.",
      "Prior low uses the minimum three-month average over the 12 months before the evaluation month.",
      "The 12-month look-back excludes the evaluation month (Claudia Sahm, 2019).",
      "Threshold is 0.50 percentage points (Published Sahm rule threshold (0.50 percentage points))."
    ],
    "limitations": [
      "This is a published association with recessions already under way, not an NBER determination.",
      "Not a forward recession forecast or an investment signal.",
      "Market pricing is not assessed here."
    ]
  },
  "source_attribution": "Source: U.S. Bureau of Labor Statistics, series LNS14000000 (seasonally adjusted unemployment rate). Retrieved on 2026-10-17. BLS.gov cannot vouch for the data or analyses derived from these data after the data have been retrieved from BLS.gov. Figures are presented as returned by BLS without modification.",
  "observation_ids": [
    "bls-202310-4051d2873d293be5a5d551b1",
    "bls-202311-993bd6d74ff8edbed313b20c",
    "bls-202312-bd7253f74e820aace7b7c609",
    "bls-202401-4b1632283428fb8491fa4e4c",
    "bls-202402-3367cffdd495715cb27fe0ce",
    "bls-202403-7a21e6ad826eb1ca2f9f465b",
    "bls-202404-20a4f0f983b62623b9b8ef29",
    "bls-202405-11e4175735ded8d14cd78a8f",
    "bls-202406-e25960a671e167fd5eb56f42",
    "bls-202407-f86fa133dc1713142e16436b",
    "bls-202408-432dfb230e2925cf2d0fb0e1",
    "bls-202409-5cf7d420412d1cce3ff8d00d",
    "bls-202410-c6d331bdade079d442c525a1",
    "bls-202411-910ac0fb77d0243604bca02c",
    "bls-202412-0c64fccc9a411d3022d37b10"
  ],
  "analytical_payload_hash": "4b17c6d4afa27c21e39d7950e60871835cc6a7b8987536699da0dfc52b3722b8",
  "evidence_reasons": [
    "publication gate remains fail-closed",
    "this assessment is not claim or span verification"
  ],
  "chart_points": [
    {
      "period": "2023-01-01",
      "value": 4.0
    },
    {
      "period": "2023-02-01",
      "value": 4.0
    },
    {
      "period": "2023-03-01",
      "value": 4.0
    },
    {
      "period": "2023-04-01",
      "value": 4.0
    },
    {
      "period": "2023-05-01",
      "value": 4.0
    },
    {
      "period": "2023-06-01",
      "value": 4.0
    },
    {
      "period": "2023-07-01",
      "value": 4.0
    },
    {
      "period": "2023-08-01",
      "value": 4.0
    },
    {
      "period": "2023-09-01",
      "value": 4.0
    },
    {
      "period": "2023-10-01",
      "value": 4.0
    },
    {
      "period": "2023-11-01",
      "value": 4.0
    },
    {
      "period": "2023-12-01",
      "value": 4.0
    },
    {
      "period": "2024-01-01",
      "value": 4.0
    },
    {
      "period": "2024-02-01",
      "value": 4.0
    },
    {
      "period": "2024-03-01",
      "value": 4.0
    },
    {
      "period": "2024-04-01",
      "value": 4.0
    },
    {
      "period": "2024-05-01",
      "value": 4.0
    },
    {
      "period": "2024-06-01",
      "value": 4.0
    },
    {
      "period": "2024-07-01",
      "value": 4.0
    },
    {
      "period": "2024-08-01",
      "value": 4.0
    },
    {
      "period": "2024-09-01",
      "value": 4.0
    },
    {
      "period": "2024-10-01",
      "value": 4.5
    },
    {
      "period": "2024-11-01",
      "value": 4.5
    },
    {
      "period": "2024-12-01",
      "value": 4.5
    }
  ]
}